{
  "schema_id": "timing_four_layer_port_contracts@1.1",
  "status": "current_shared_prestrategy_ports_parameter_selection_after_layer4",
  "parent": "timing_four_layer_port_contracts@1.0",
  "roles": {
    "Layer1": {
      "phase": "PreStrategy",
      "ports": ["BarViewPort@1.0", "OptionMarketCoordinatePort@1.0"],
      "allowed_consumers": ["Layer3", "Layer4"],
      "parameter_selection_authority": false
    },
    "Layer2": {
      "phase": "PreStrategy",
      "ports": ["FeatureProviderPort@1.0", "OptionVolatilityFeatureProviderPort@1.0"],
      "allowed_consumers": ["Layer3", "Layer4"],
      "parameter_selection_authority": false
    },
    "Layer3": {
      "phase": "StrategyConstruction",
      "port": "StrategyPolicyFamilyPort@1.0",
      "output": "complete_result_free_parameter_family",
      "selected_parameter_id": null,
      "parameter_selection_authority": false
    },
    "Layer4": {
      "phase": "AfterStrategy",
      "ports": ["AccountFamilyReplayPort@1.0", "Layer4OptionVolatilityBindingPort@1.0"],
      "parameter_selection_receipt": "Layer4ParameterSelectionReceipt@1.0",
      "prestrategy_direct_calculator_allowed": false,
      "parameter_selection_authority": true,
      "production_authority": false
    }
  },
  "connection_authority": "per_strategy_StrategyAssemblyManifest",
  "layer1_layer2_equal_consumer_rule": true,
  "global_component_chain_locked": false,
  "new_selected_parameter_without_layer4_receipt_allowed": false,
  "strategy_behavior_change_requires_strategy_slice_rebuild": true,
  "post_training_account_audit_required": true,
  "production_authority": false
}

